{"contract_version":"1.0.0","product":"axon","server_id":"axon_0123456789abcdef","product_version":"7.2.2","api_version":{"major":1,"minor":0},"capabilities":["source","query","ask"],"auth":{"modes":["static_bearer","oauth2"],"issuer":"https://axon.example.com","audience":"https://axon.example.com","token_endpoint_origin":"https://axon.example.com","principal_cache_scope":"subject+issuer","credential_generation":"1"},"streams":{"transport":"sse","resume":"opaque_cursor"}}
